{
  "$schema": "https://godot2amiga.org/schemas/g2a/export-profile.schema.json",
  "id": "amiga500-ocs-pal",
  "machine": "Amiga 500",
  "chipset": "OCS",
  "cpu": "68000",
  "video_standard": "PAL",
  "chip_ram_kib": 512,
  "fast_ram_kib": 0,
  "runtime": "ACE",
  "display": {
    "palette": "display",
    "bitplane_depth": 2,
    "interleaved": true,
    "double_buffered": false
  }
}
